{
  "schema_version": "my-data-hub-checkpoint-acceptance-intent.v1",
  "scenario": "FM14",
  "operation_id": "66666666-6666-4666-8666-666666666666",
  "task_run_id": "44444444-4444-4444-8444-444444444444",
  "idempotency_key_sha256": "a26e640bac4404377b1f63df6af30c0038e393cae64f7b2a4a75a136c79bfae9",
  "source_revision": "bbbbbbbbbbbbbbbbbbbbbbbbbbbbbbbbbbbbbbbb",
  "candidate_checkpoint_id": "55555555-5555-4555-8555-555555555555",
  "evidence_class": "injected",
  "initial_head": {
    "generation": 7,
    "current_checkpoint_id": "11111111-1111-4111-8111-111111111111",
    "previous_checkpoint_id": "22222222-2222-4222-8222-222222222222"
  },
  "timeout_seconds": 900,
  "max_attempts": 3
}
